downs,epoch_time,score,subreddit,text,title,unique_post_id,ups,upvote_ratio,user_id
0.0,1471204895.0,3.0,caltech,"Long story short, I need to start grad school in Caltech this fall and I just know this two weeks ago. And now I need a place to live so I'm here looking for options if anyone has some. If anyone is in similar situation and need roommates to co-lease somewhere or suggestions on things in general please let me know. Thanks a lot!

Also, I don't know if there's any resources for incoming (grad) students to connect and meet potential roommates?",Looking for roommate/room/apt etc.,t3_4xpslc,3.0,0.81,polarbearxx
0.0,1470174108.0,20.0,caltech,,Nobel Prize-winning Egyptian chemist Zewail dies: state TV,t3_4vv0r7,20.0,1.0,fatOLDwhiteGUY
0.0,1469484409.0,3.0,caltech,Caltech grad student here having a heck of a time actually finding a place to live next year and will be homeless in the near future. I think I've contacted about 50-60 different places by this point all with no success and it is starting to consume my life. Does anyone know of any vacancies or if there is somebody who is looking for a roommate? ,Do you know anyone looking for a roommate?,t3_4ul7yo,3.0,0.81,parchedshark
0.0,1469027900.0,5.0,caltech,"Looking for writers/thinkers for a potential writing opportunity on Caltech's campus. I know Caltech students like to focus on STEM applications to the world, and I think that's a really unique perspective that doesn't get put into words often enough. Wondering if there are any groups or locations on campus where writers would congregate?",Looking for writers at Caltech,t3_4trmic,5.0,1.0,willprigge
0.0,1467174033.0,19.0,caltech,,The dying breed of craftsmen behind the tools that make scientific research possible,t3_4qdp7a,19.0,0.89,BlankVerse
0.0,1465846228.0,7.0,caltech,"I'm an undergrad at a large state school right now with a really good research program. I've pretty much spent the last two years here upset about not getting into Caltech, because everything I've heard about it sounds almost too good to be true (well, aside from the workload). Honor code, very student-driven university/dorms, people who are excited to talk about science to name a few.

I'm wondering if there is anything special about the culture of the grad school at Caltech, or if it's really just your average research school once you get out of undergrad. I like the location of my university a lot better, and for research it has everything I need, but I'm just concerned about how much fun I would have in the process.",Is grad school here anything like the undergrad experience?,t3_4nxcm7,7.0,1.0,caltechgradmaybe
0.0,1465715693.0,21.0,caltech,,"The Mistrust of Science - The following was delivered as the commencement address at the California Institute of Technology, on Friday, June 10th.",t3_4npak7,21.0,0.96,RheingoldRiver
0.0,1465573108.0,3.0,caltech,I'm interested in their GALCIT and Aerospace Programs. Would anyone have any advice of how to prepare myself to be a strong candidate for admissions? I'm currently sitting on a 4.0 and already have a years worth of research experience and two years to go with the possibility of publication. Thanks!,Third year mech. engineering student planning on applying to Caltech for grad school. Any Advice?,t3_4ngvkw,3.0,1.0,codydschultz
0.0,1464936502.0,2.0,caltech,"I am wondering if Caltech has course review webpage (the ones where student can leave their comment after taking a course). The one similar to Rate My Prof. 

Also, I am wondering if Caltech has webpage that reveals grade distribution (the course average and maybe the percentage of people getting certain grade)?

Thx in advance.",Does Caltech has course review page?,t3_4mbnv3,2.0,1.0,randy_housie
0.0,1464808322.0,2.0,caltech,Just wondering since the cost of living in Pasadena is very high. (I am poor). ,How much does a Teaching Assistant earn over the semester？,t3_4m2yoc,2.0,1.0,randy_housie
0.0,1464708900.0,1.0,caltech,"Hey folks. You probably get sick and tired of these, and yes, I have read your replies to the recent posts in similar vain.

Like apparently everyone here, I have a 4.0 unweighted GPA, am planning on taking 9 or so APs, have a 1550 SAT score and am prepping for the SAT Math 2 and the SAT Physics. I plan on majoring in Physics, perhaps with a minor in aeronautics.

The overwhelming consensus seems to be that you should take your love of STEM *out* of the classroom and apply to college internships. This seems easy enough.

However, a recurring theme seems to be ""president of school classs"" or ""vice president of the physics society"" or some similar white, upper middle class, suburban school association, all of which I do not have access to being homeschooled. Aside from internships, is there anything I should/can do to make up for this?

BTW I am a freshman, entering my sophomore year.","Look, another ""how to get in?"" post by a HS student- want to know how my being homeschooled affects me.",t3_4lvsy7,1.0,1.0,BioticAsariBabe
0.0,1464633313.0,16.0,caltech,,Caltech Accuses Apple of Violating its Patented Wi-Fi Technologies,t3_4lqwtf,16.0,0.95,Phdinneuroscience
0.0,1464450342.0,1.0,caltech,"Starting at Caltech in the fall; will be living in grad student housing. Does anyone here know ...

(1) How common it is for grad students to bring cars? If uncommon, what is the norm for getting around?

(2) How much do various parking arrangements cost (e.g. street parking, on campus parking, etc...)?

Thanks everyone!
",Parking around campus? Near / for grad student housing?,t3_4lgamf,1.0,1.0,inventor1488
0.0,1463844383.0,6.0,caltech,"I'm about to start by PhD at Caltech would like to develop a longstanding interest I've had in dance. I'm interested in having fun (i.e. freestyle dancing) and working with pop/ rock/ alternative music-- not creating critically acclaimed art. 

Are there any such groups on campus? 

Note : I googled ""dance at Caltech"" but I can only find groups for which (1) members appear to have been involved with dance in some formal capacity prior to joining the Caltech group, or (2) a *specific* type of dance is practiced (salsa, swing, ballroom, etc..).",Dance groups on campus?,t3_4ke0al,6.0,1.0,inventor1488
0.0,1463187647.0,1.0,caltech,"Hello! 
I'll be living in the Caltech dorms for the summer and I wanted to have my own minifridge for the summer. Anyone here have a mini fridge I can buy or even rent for this amount of time? I'm concerned about going on Craigslist and buying a defective one. 
Thanks!",Looking for a minifridge for the summer.,t3_4j9cg5,1.0,1.0,thelittlecardigan
0.0,1463104248.0,7.0,caltech,,"Just committed to Caltech for my PhD, but having doubts about (1) living in LA and the icky traffic, (2) not having nature nearby, and (3) not having the interdisciplinary resources available on a larger campus (ex: energy and resources group at Cal). Thoughts?",t3_4j43qe,7.0,1.0,rwrwrwrwr
0.0,1462962522.0,24.0,caltech,,"Tom M. Apostol, 1923–2016 | Caltech",t3_4iua5t,24.0,1.0,RheingoldRiver
0.0,1461955492.0,9.0,caltech,,Break Through: The Caltech Campaign,t3_4h0vhd,9.0,0.85,RheingoldRiver
0.0,1461278706.0,1.0,caltech,,Use your skills to make LA more accessible for people with disabilities! Get your hack on at the Solve For One hackathon!,t3_4fvkmb,1.0,0.67,marytoves
0.0,1460344711.0,3.0,caltech,"Hello I am currently a junior in secondary school in Canada and I was wondering if I am taking the correct steps to get accepted into Caltech. I currently have a 3.9 accumulated GPA and a unweighted 4.0 GPA for grade 11 so far. My practice SAT's for the Revised SAT range from 1400-1500 (there haven't been any official tests in Canada yet) and I plan on doing SAT II math II and physics subject tests this year. I have the top mark in Chemistry 11, Physics 11, and Sports Medicine 11. I also had the third highest mark in my IB math class. In addition this semester I have IB Physics, IB English, and Computer Programming 12 wherein I am among the top 5 students in both IB Courses and the top student in CP with 100%. I currently do competitive springboard diving and therefore do not have much time for science clubs. Nevertheless does it help that I am one of the top ranked users in Code Combat for python and I am currently learning Javascript? I intend to enrol in either Computer Engineering or Mechanical Engineering. As an international student what can I do to raise my chances of getting accepted?",How do I increase my chances for Caltech?,t3_4e90dw,3.0,1.0,FrancyCakers
0.0,1460232314.0,0.0,caltech,"Hello! I am a freshmen in high school and Caltech is what I'm gunning for. I would love to study physics and philosophy in my future. I am just wondering what looks good on an application and what I should do to increase my chances of getting in. Currently I am a straight A student, president of my own club of philosophy, Vice President of our MESA club, and treasurer of our Skills USA club. Outside of school, I do cross fit and am learning guitar and how to play music. Also, would taking collage classes over summer help? Thanks in advance!",Applying to Caltech,t3_4e2s80,0.0,0.5,MrMistyMind
0.0,1457059303.0,3.0,caltech,"Hi all, I was accepted EA to Caltech this year and had some questions about Caltech. It would be great if someone could answer them for me.

1. How is the food? Cafeteria food, local delivery services, LA, etc.
2. If I want to study Physics/Applied Physics, how much non-Physics work will I be required to do per semester? Notably ones with essay writing or literature reading. How are the requirements compared to other universities?
(2.5) If they exist, do these non-science courses have a defined course list (everyone takes the same required courses) or is there a broad selection of courses that satisfy the humanities requirements? Would taking a lot of music courses be able to satisfy them? If not, what is the least painful way to satisfy these requirements for someone who hates to read/write?
3. Will I be stuck doing psets every weekend, or is it possible to have free time and go to LA/do other things?
4. I've heard various rumours about Techers being extremely odd people (""the goods are odd""), how true is this? I think there is a difference between being motivated to do work and being plain weird/antisocial/lacking empathy.
5. How is the shower/toilet quality, does it vary by house?
6. Do the math/science courses typically involve some kind of technology application (matlab, mathematica), or is it mainly theoretical? How theoretical are the courses compared to those at other universities?
7. I am interested in the Caltech-Cambridge exchange program (I was accepted to Cambridge as well). Is that still running, and will I be able to graduate on time if I do it?
8. How cold/hot does it get in California?
9. Are there a lot of League of Legends players?

Thanks in advance, might have missed a few questions.

edit: some more questions

10. Sports - any badminton, archery, or kendo in Pasadena?
11. Major options - in a ranking of theoreticalness, what are Astrophysics, Applied Physics, Physics, and Applied Computational Maths like?",Questions About Caltech - Prospective Undergraduate Student,t3_48vejd,3.0,0.72,BadMangoes
0.0,1456338482.0,3.0,caltech,,Caltech Public Events Calendar called out in the New York Times,t3_47e1gc,3.0,1.0,onedatewonder
0.0,1456231285.0,11.0,caltech,,The Caltech musical parody of Star Trek you never knew you always wanted is here,t3_476f0p,11.0,1.0,RheingoldRiver
0.0,1456132380.0,1.0,caltech,"Hi all! I'm a current sophomore.

Although I'm already two years in, I am still grappling with understanding why humanities classes are required at Caltech. About every couple of weeks I tend to oscillate between an edgy teenage voice in my head saying ""the humanities are worthless!"" and a more calming voice of reason saying ""humanities classes help you think critically and process information."" However no matter what I just can't suppress that voice in the back of my mind questioning the usefulness of the humanities courses.

I can see humanities classes being useful if done in a sincere way, but from my experience most humanities courses are not done as sincerely as faculty might hope. For example, just a few minutes ago I heard someone in my hallway exclaiming, ""I have an essay and two problem sets due tomorrow! I'm just going to BS something for the essay and hope I get an A!"" I am occasionally drawn to this type of thinking as well, even if I know how insincere it is.

All this makes me question how useful of an exercise it is to require undergraduates to take 12 humanities courses over 4 years. One response may be that humanities classes help with writing, and eventually yield dividends when it comes to scientific writing. But in that case, why doesn't Caltech have students primarily take scientific writing courses instead, or require an undergraduate research thesis? Why does writing education have to be delivered through a broad range of topics ranging from social sciences to philosophy? Another response may be that humanities classes provide a break from the sciences, but to me it seems like having no humanities requirement would be reduce stress by providing more free time to students.

Whatever Caltech's end goal for us is, why does it have to be executed through 12 humanities courses, four of which are humanities, four of which are social sciences, and four of which are wildcard courses? It seems somewhat arbitrary, and I have trouble seeing if there would be an effective difference in our educational outcomes if no humanities courses were required at all. ",Explain the Humanities requirement to me.,t3_4701u7,1.0,1.0,barbarr
0.0,1456117667.0,3.0,caltech,"I would really love love to study AI here but I havent been able to find much stats for the CS PhD program.

I am definitely not super genius cream of the crop I imagine caltech is full of so its pretty intimidating. I still have pretty good scores but not perfect. Am I screwened for example if I havent done any research in my field (I have done something else under SURF)?






",How hard is it to get into CS graduate program here?,t3_46zbxp,3.0,1.0,barenba
0.0,1455308920.0,6.0,caltech,,Observation of Gravitational Waves from a Binary Black Hole Merger,t3_45go2p,6.0,1.0,RheingoldRiver
0.0,1454193793.0,11.0,caltech,"I just walked past an alumni lunch event on campus. It looked like each attendee had registered in advance to order the type of sandwich they wanted to eat. But the system for distributing sandwiches was cringe-worthy and anxiety-triggering. Everyone had name tags - for socializing purposes - which they had to take to the sandwich table to get their food. The caterers knew which sandwich to provide each alumnus because their order was printed on their name tag. Now, I'm uncomfortable announcing to the world my sandwich preferences; I feel like this system would have discouraged consumption of exotic sandwiches except I doubt anyone expected to be outed when they signed up. But the worst part was the layout of the name tags: all the text was in the same size and font. From a distance, I figured the name tags read, for example, ""John Doe: Class of '84"" or ""Jane Doe: Software Engineer at Microsoft,"" but as I neared the mass of awkwardly small-talking ex-students I realized to my amusement their identifiers were all of the form ""Mary Smith: Ham Sandwich"" or ""Bill Johnson: Turkey and Cheese."" Just terrible. Had I been part of the event I would have left out of embarrassment once this incompetence was revealed to me but only after snatching up my badge from the registration table as to conceal my secret identity as a ""BLT hold the onions."" And just imagine the icebreakers: not ""BS in Physics? me too!"" but rather ""So how was the roast beef?"" Luckily today I could observe from a safe and private distance. I considered lying my way into free food as I often do, but then I thought of the poor alumnus who would drive across the state in search of nostalgic moments with old buddies only to discover his meticulously planned sandwich missing, the scarlet letter pinned to his chest a constant reminder of his hunger and a testament, in the eyes of his peers, to his deeply held sandwich preferences - the very core of who he had become since graduating. Empathy overcame schadenfreude; I just couldn't do it.",how caltech treats its alumni,t3_43gc5c,11.0,0.72,billnyesandwichguy
0.0,1454038727.0,3.0,caltech,"I'm a student at the University of Michigan, and I just got an internship in Pasadena for the summer.  I'm looking for a place to rent a room, but all the places on airbnb are too expensive and places4students doesn't have any postings yet.  Do you know anyone who is looking to rent out their room over the summer? If it's going to sit empty anyways they might as well make some money off of it.

I don't want to give too many personal details on reddit, but I will in PMs if you want.  Broadly, I'm a college-age girl into music and computer science. 

Thanks for any tips you can give me for finding someplace to live!",Looking for an affordable place to sublease this summer,t3_4371io,3.0,1.0,nroblezae
0.0,1453879944.0,17.0,caltech,"**I’m a Caltech grad student and I’m going to be writing anonymously.**
 
&amp;nbsp;

Over the past few months I’ve found myself typing into Google “I hate Caltech,” trying to find some satisfying anti-Caltech comments to empathize with and help me vent. 

&amp;nbsp;

I feel like I can’t complain about Caltech to my fellow students; if you complain it looks like a sign that you personally are just doing poorly, and so you are mad. 

&amp;nbsp;

But that’s not the case. I’ve done well in classes. I passed my qualifying exam on my first try. My peers know I’m smart. But I am mad, here’s why:

&amp;nbsp;

1\. My first research advisor was unprofessional. He told me repeatedly that I ""didn’t know how to do research."" He told me that I was not working hard. He told me at one point that I didn’t know how to read. When I left his group, he said unprofessional things about me to the other graduate students in the research group. I'm still left wondering if the fact that I am a woman caused him to treat me differently. 

&amp;nbsp;

2\. My department is Really unorganized. Last year my department devised a new set of classes that are required for all new students. Almost ALL the classes I took in my first year were completely NEW classes, and the class organization, the lectures, and the homeworks had definite BUGS. We were unfortunate guinea pigs.  

&amp;nbsp;

3\. The date of the PhD qualifying exam kept being postponed, for over a month. It was the biggest test of the year, but we didn’t know if suddenly they would say, ‘Oh, we scheduled your test for tomorrow.’ If the department doesn't take the students' time seriously, how are we going to take them seriously? This kind of behavior would be unacceptable in an industry or professional setting. 
 
&amp;nbsp;

I could go on, but I don’t want to complain. I want to move on, and focus on my research. But something last week brought it all back. I read the BuzzFeed and NYT articles about two girls who were harassed by a professor. 

&amp;nbsp;

I feel lucky that my first advisor wasn’t as bad as that. But he made me feel terrible, and I really did question my worth as a researcher. I felt that maybe some of the things he said to me were at least partly true. And I am a woman, and I really hope that he didn’t treat me differently because of it. 

&amp;nbsp;

I’ve found a new advisor, and things are generally OK. 

&amp;nbsp;

**But, I still feel mad.**

&amp;nbsp;

I feel that Caltech is not giving me what I need as a researcher. The departments are very small, and I don’t have enough people to interact with. I went to a large university for my undergrad, and everyone bounced ideas off of each other. 

&amp;nbsp;

Now, sometimes I stand in the main lobby of my building, at 1pm, and no one else is to been seen. Only maybe a secretary, always an older woman, will walk by, and smile at me. 

&amp;nbsp;

**Does anyone else feel the same way?**
",A Letter to Caltech,t3_42weuc,17.0,0.95,caltechGRAD
0.0,1453764572.0,7.0,caltech,"I am looking for a Techer either studying EE or with EE interests to do various electronics odds-and-ends tasks. It could be anywhere from doing some wire crimping and soldering, assembling PCBA's into housings, doing some datasheet lookups and creating footprints for Altium, or even checking/creating schematic capture and PCB layout work.

If you are interested in any or all of the above tasks, please drop me a line with what work interests you, your general background so that I can get a feel for you as a candidate, and your hourly rate that you'd like to ask.

We have a shop in Pasadena near PCC. Most of the work you can do at your place, and I can bring the material to you as needed, so you don't have to have your own transportation.

If you also do 3D CAD modeling and/or 3D printing; or have an interest in that, please let me know as well.

If you have a friend that might be suitable, please pass this on to him/her!

Thanks!

Joseph B.S. E&amp;AS ~~'93~~  ~~'94~~  '95 (Damn you, AMa95!)",[HIRING] Looking for Techer for occasional part-time EE/ME/light assembly work.,t3_42ohae,7.0,1.0,toybuilder
0.0,1453324790.0,15.0,caltech,,Caltech Researchers Find Evidence of a Real Ninth Planet,t3_41wfl0,15.0,0.95,RheingoldRiver
0.0,1452660955.0,3.0,caltech,"Hi there, I'm Harel. If you're not sure how to pronounce that, don't worry; most people can't. I'm a prefrosh, which means I don't know much about Caltech past what I've seen on tour and what I've obsessively read from the university website and information packets. I enjoy sushi, singing, and reading...... physics textbooks. Even though I won't be on campus for another several months, I feel like more of a Caltech student than one at my high school (which isn't hard because I haven't attended classes there for 2 years). How's everyone doing?","Ok, I want all of us to take a moment, put in some effort, and say something, because this subreddit is dead.",t3_40qgfe,3.0,0.72,harel55
0.0,1452656864.0,24.0,caltech,,Caltech suspends professor for harassment,t3_40q73q,24.0,0.97,RheingoldRiver
0.0,1452226328.0,3.0,caltech,,Sexual harassment issue at Caltech now?,t3_3zzf4j,3.0,0.67,johnneyj
0.0,1451436952.0,1.0,caltech,"What would your recommendations for housing in the Pasadena area? Are there any specific areas I should look into/avoid?

Any advice would be welcome.
Thanks!",Prospective Graduate Student: Housing Close to Campus,t3_3yq21d,1.0,1.0,ccx806
0.0,1451320876.0,2.0,caltech,"How easy is it to get to LA and Hollywood? I can't seem to find anything on Caltech's website. In deciding between Caltech and other places, where I'll be living for several years is a pretty significant factor for me. Thanks!",Prospective Grad Student: Traveling to LA,t3_3yjf1u,2.0,1.0,blocho125
0.0,1450381421.0,4.0,caltech,Is there a way to forward emails to a new address? I need to include an email address in a manuscript. Thanks!,What happens to your @caltech.edu email after graduation?,t3_3x94e0,4.0,1.0,dedicateddan
0.0,1449080051.0,4.0,caltech,"Hello, I've recently been chosen to go to CalTech for the 1st term in 2016 (September - December), and I was wondering if some of you could give me an insight into the work load in the different subjects I've thought about taking:

BEM103, Introduction to Finance 				
SS/Ma 214, Mathematical Finance				
Ma 147 abc, Dynamical Systems				
CMS/ACM 116. Introduction to Stochastic Processes and Modeling

CMS/ACM 113. Mathematical Optimization 		

Are any known to be really hard, really easy, what are your thoughts on the courses etc. Any feedback / general tips and tricks would be appreciated! ",Exchange Student Fall 2016,t3_3v67ew,4.0,1.0,Sren001
0.0,1448936272.0,3.0,caltech,Each house seems to have its own personality/stereotype so I was wondering if there was any noticeable trend going on between these stereotypes and academic field or option.  Any insight?,Any correlation between House and Options (Majors)?,t3_3uxwap,3.0,0.81,lupicorn
0.0,1448396449.0,2.0,caltech,"I made this survey that should only take a minute or two to complete, but it has been fairly difficult to get people to respond. I need a pretty large sample. I would be forever grateful if you filled it out. 
Here's the link:
http://goo.gl/forms/Vgnkv2jJs5",I'm doing research on learning styles in STEM majors. Please help!,t3_3u4f6x,2.0,1.0,Axewave
0.0,1441640397.0,1.0,caltech,,What sort of research opportunities are available for Caltech undergrads to work at JPL?,t3_3jzd81,1.0,1.0,polartundrabear
0.0,1445306532.0,7.0,caltech,,A massive improvement of caltech.edu,t3_3pfosq,7.0,0.99,RheingoldRiver
0.0,1443085578.0,2.0,caltech,"Hey everyone,

Is it possible to double or triple up on hums or HSS courses each term? I want to get a bunch of prerequisites out of the way so I can take some cool advanced classes senior year, but to avoid overloading I have to skip hums...Anyone having the same problem as me?",Doubling up on hums?,t3_3m6g9y,2.0,1.0,caltecher1234
0.0,1443048826.0,2.0,caltech,"Hey everyone,

I'm a high school student interested in Caltech and I was wondering if you guys had a men's rugby team. I cant find any information whether or not you do online. 

Thanks for the help. ",Rugby at Caltech?,t3_3m4mac,2.0,1.0,JDscar
0.0,1442978256.0,13.0,caltech,,Caltech Releases Results of AAU Campus Climate Survey on Sexual Assault and Sexual Misconduct,t3_3m0t3h,13.0,1.0,RheingoldRiver
0.0,1442368932.0,11.0,caltech,,"Throop Polytechnic Institute, Pasadena, California, 1908. Now The California Institute of Technology or Caltech. The school was founded as a preparatory and vocational school by Amos G. Throop in 1891.",t3_3l4c57,11.0,0.91,michaelconfoy
