downs,epoch_time,score,subreddit,text,title,unique_post_id,ups,upvote_ratio,user_id
0.0,1591553114.0,5.0,caltech,"Hey everyone,

Current aerospace engineering bachelors at an R1 university looking at potential master's programs. My goal is to work in the space industry -- preferably at SpaceX, JPL, Virgin, Blue Origin type companies, either in the space systems or space GNC/astrodynamics fields. I'd love to attend Caltech's Masters in Aerospace engineering program, but the cost is exorbitant (both for tuition/fees and cost of living in LA) and they do not offer TA positions to MS students. I'm not stupid enough to take out student loans (fuck them since they drive up the cost for the rest of us) so I won't go anywhere that I won't get funding. Caltech is appealing because it's close in proximity to all of these amazing space companies, and along with USC and UCLA, Caltech is the one of the most common school for people working at these companies due to that prestige and more importantly, proximity.

**Does anyone have any feasible solutions for obtaining funding (AS AN ACCEPTED Aerospace MS candidate), preferably before I have to make any decision to commit?** i.e. As an accepted MS candidate, is it feasible to reach out to professors to secure Research Assistantship funding before I have to make a decision or is it at all likely that I'd be able to actually secure a teaching assistantship position in another department (i.e. EE, Math, etc.) as the department website suggests?",Caltech Aerospace Engineering Master's Degree -- How To Get Funding?,t3_gyh4rd,5.0,0.86,SlicedPotato117
0.0,1590508108.0,3.0,caltech,"Hi!! I’m an undergrad going into my fourth year of my bsc in physics and trying to figure out where to go for grad school! I have been considering applying to Caltech for a while and it’s kinda becoming my dream school. I want to be more sure of my choice though, because holy moly american post secondary is so expensive! I have a couple questions about grad school at caltech, if anyone’s in physics that would be amazing too!
1) How do you like life on campus, especially as someone who is not american? (I’m from canada) was it easy to meet people?
2) how much funding can you get, again, especially as someone who is not american?
3) do you automatically get a TAship when you’re a masters student?
4) after a year of studies, can you switch from masters to PhD?
5) is it more course or research based?
6) do you need to apply with a supervisor in mind, or do you find a supervisor once youre already in the program?

Any other general advice would be great too, thanks!!! :)",A confused prospective grad student,t3_gqzikw,3.0,1.0,camnund
0.0,1589923816.0,12.0,caltech,"For any of you who've ever found yourself serving as the science advisor for your friends and family, we're excited to share the new [Caltech Science Exchange](https://scienceexchange.caltech.edu/?utm_source=reddit&amp;utm_medium=socialmedia&amp;utm_term=&amp;utm_content=a3f14b23-7dcb-4631-a957-97454adee21f&amp;utm_campaign=cseviruses), a new web resource dedicated to clear and credible explanations of high-profile science and engineering topics.

The site launches with a focus on the COVID-19 pandemic, and core concepts and questions in virology, such as “What is a virus?” and “How are vaccines developed?”. In coming months, you’ll see the scope of the site expand to include other key topics, such as sustainability, neuroscience, and artificial intelligence.

We hope you'll explore the site and share it if you find it informative and useful!",Introducing the Caltech Science Exchange,t3_gmxqyn,12.0,1.0,caltechedu
0.0,1589554090.0,19.0,caltech,"Hi Techers,

I'll be a new frosh next year and I had a few questions about taking notes in lectures or other classes. Do professors/TAs mind if you use a tablet (like an iPad) to take notes? Is it fairly common for students to do so? Please let me know as I'm considering getting one for next year. Also if you have any others tips I would really appreciate it!

Thanks! :)",Notetaking with a Tablet,t3_gkagl3,19.0,1.0,l22jordan22
0.0,1588983535.0,83.0,caltech,,My New Shirt Came In! (I also got the mugs too!),t3_gg51kv,83.0,0.96,Tomstah
0.0,1588916320.0,62.0,caltech,,"My undergrad's subreddit had so many great memes so this sub was a disappointment, but something controversial finally happened so here we go",t3_gfn86k,62.0,0.96,Short_Computer
0.0,1588792209.0,21.0,caltech,"I am deciding between Caltech and another bigger school for CS (just got off a waitlist) and was wondering if the small size at Caltech means that less companies come to actively recruit students. 

Also, how does Caltech's emphasis on theory rather than application affect job search and internships?

Sorry if this has been asked before, but I would love to hear experiences from Caltech CS students who have been through internship/job search processes!",How much does Caltech's small size impact recruiting?,t3_geqckv,21.0,0.93,URGENTCOLLEGEHELP
0.0,1588788973.0,21.0,caltech,Just want to know how my fellow nerds get down.,What’s Caltech’s hookup culture like?,t3_gepbjn,21.0,0.89,happylemons16765
0.0,1588668526.0,23.0,caltech,"I learned the besks are gone from the South Houses and I'm so sad to hear that. I know about Bechtel and rotation, but what are small things alumni probably haven't heard about that have happened recently? Anything positive?",What small things have changed about campus life in the past 5 years?,t3_gdu4i6,23.0,0.97,RheingoldRiver
0.0,1588456068.0,11.0,caltech,"Does anyone have advice as to whether we should bring a desktop? For a major like electrical engineering is it useful for heavy projects or would it just be redundant? Do y'all spend enough time working in your dorm rooms to justify bringing one? Alternatively, are video game parties or group game hangouts common where a good pc could be leveraged? Thanks y'all :)",Bringing a desktop?,t3_gcen5r,11.0,0.87,mark-6
0.0,1588115410.0,11.0,caltech,"Could anyone here offer some insight into choosing between Caltech and Stanford for undergrad in aerospace engineering? Yes, I do realize that for Caltech, I'd have to do the MechE Major + Aerospace Engineering Minor to do something like an aerospace major.",Insight into a decision for Aerospace,t3_g9xwyl,11.0,1.0,Radio-Listener
0.0,1587831039.0,14.0,caltech,"I'm a student who will be going to Caltech in the fall. I am blessed to not need financial aid, and Caltech accordingly didn't provide any. However, I would still like to apply for scholarships to reduce to burden on my family. Can anyone please suggest need-blind merit scholarships that a student who has graduated from high school can apply for. I am not a URM or of any special background, just a generic Asian male. 

Any tips or advice, even for things I can do once I am on campus or other opportunities I can take advantage of, would be a huge help.

Thanks!",Need Blind Scholarships,t3_g7w1g9,14.0,0.94,EquisSatya
0.0,1587688380.0,8.0,caltech,"This might be a shot in the dark, but has anyone extended the length of their MS? I understand the pure MS/no PhD is rare here, but I just committed to the MS in EE program. I could apply to the PhD in the Fall, but am not sure I want to commit to a PhD program, and would want to try research here before applying to PhD programs. It would also probably help my chances before applying.

Anyone have any advice?",Extending 1 Year MS,t3_g6yia5,8.0,1.0,bluesjey
0.0,1587603852.0,9.0,caltech,"Waitlist kid here,

In light of the pandemic, some schools have had less than great responses to closures, vacating campus, and shifting classes online. Have you felt Caltech has done a good job of that? Do you think they treated First Generation/Low Income students fairly? International Students? It's sad to see some elite schools either don't care about their FGLI population or are too administratively challenged to do so.",How has response to COVID-19 been?,t3_g6dew5,9.0,1.0,sumguy3111
0.0,1587252262.0,12.0,caltech,"Hi there, I've been admitted as a Prefrosh to the class of 2024! I'm currently deciding between a few schools, so I'm just trying to get a feel for what life will realistically be like as a student (especially since I'm no longer able to visit). I've heard that at many prestigious schools, especially in STEM, the atmosphere is very competitive, and students will often try to sabotage each others' assignments and projects. Is this true for Caltech as well? As well, any other feedback about student life would be appreciated. Thanks!",Undergrad Culture at 'tech,t3_g3xahy,12.0,1.0,sqrtofnegativeseven
0.0,1587242400.0,15.0,caltech,"hello! i was admitted into the co'24 at caltech and im trying to find discords or group chats for accepted students. i was wondering if anyone has any info on this, thanks!",help with finding other accepted students for co'24 at caltech,t3_g3umhq,15.0,1.0,sravb
0.0,1586791274.0,14.0,caltech,"Sorry to fill the sub with another one of these posts. Currently I'm leaning towards Caltech over CMU, but I have a few nagging concenrs I'd like to get y'all's opinion on. Obviously, I’m unable to visit either school before I have to make the choice.

Quick background on me (skip to the numbered part if you don’t care): My primary interest is in Robotics, I’d likely take additional classes in EE/ME/Robotics/CDS regardless of where I go. On CS, I’d say I’m slightly more practically oriented than theoretical (in subject area, not looking for an SWE degree), but that doesn’t mean I’m not excited about PLT/Category theory, cryptography, or the mathematics of distributed systems.

From what I’ve been able to find so far, Caltech offers challenging CS courses, if admittedly challenging in a different way than CMU. I’m not the biggest fan of the core requirements and lack of AP/college credit; some quick math showed that ***40% of all credits at Caltech will be spent taking core requirements***, (assuming 5 classes for 12 quarters averaging 9.7 credits each) compared to 23% at CMU. I’d be curious to hear more about the value of that.

My main concern is about the depth/breadth of CS classes and the variety/availability of research positions in CS/Robotics.

1. Did/does the core requirements get in the way of other classes you wanted to take? Do you plan on doing anything with the things learned in core classes? CS Alumni: Do you wish you had taken more CS or more other stuff?
2. Have you ever felt that a CS course lacked depth/breadth? How theoretical vs. practical are the curriculum offerings? Alumni: did you feel prepared for industry work, and what do you do?
   1. My concern stems from [posts like this](https://www.quora.com/What-is-it-like-to-be-a-computer-science-student-at-Caltech/answer/Jessica-Su) or [this](https://www.reddit.com/r/berkeley/comments/sn9lg/where_should_i_go_for_undergrad_cs_berkeley_or/c4ffi82/). Quote: ""Now that I've spent some time at Stanford, I think my Caltech experience was limiting.  There were entire fields of CS that I hadn't heard of before coming to Stanford (like programming languages and HCI).  Also we didn't have a lot of systems classes, so when I got to Stanford I had to take a lot of breadth requirements that most students placed out of.""
   2. Looking at the course catalog, most bases seem to be covered. From the best I can tell, notable omissions include compilers/optimization, possibly reinforcement learning, and several courses not offered this year, without any information about their return.
3. I know there are ample research opportunities at Caltech, and that they are fairly easy to get. My concern is the availability of positions in things I’m interested in that involve meaningful work. This stems from the small size of the CS department, combined with anecdotes like [this one](https://www.quora.com/What-is-it-like-to-be-a-computer-science-student-at-Caltech/answer/Martin-Michelsen): “It seemed to me that there were plenty of opportunities for research, but not many of them were pure CS; most opportunities were collaborations with other departments.” How much choice is there in research opportunities?
4. How common is it to take graduate courses?
5. (for alumni) Has core actually helped you in your career? What have you used it for? Has the Caltech “network” helped you at all?

**TL;DR:** 1. How much does core interfere with work in your major? 2. Does the smaller offering in CS courses reflect lack of depth in topics? 3. How much choice is there in research opportunities?",Help ease my concerns choosing Caltech over CMU for CS,t3_g0kz2v,14.0,0.95,csdecider
0.0,1586748241.0,3.0,caltech,"I am not sure if I am the only one, but I applied for a graduate program at Caltech last December for the Fall 2019 semester and still haven't heard anything back from the graduate admissions office. I was told to expect an answer no later than 1st of April, and from then on I was given the cold shoulder. I haven't heard back from them since and they don't answer either emails or phone calls. It is honestly a joke at this point. I am not going to go as low as to ask for a refund as there may be a reason for the delay and could be caused by the current pandemic. All I can say is that it has been nothing but unprofessional from their side. If anyone has or has had a similar experience please share.",Caltech Admissions not responding,t3_g0ax5k,3.0,1.0,SonOfOrator
0.0,1586647889.0,6.0,caltech,"Hello, I am currently a undergraduate junior at rensselaer polytechnic institute pursuing a dual major in electrical and computer engineering. I am currently doing research in machine learning for electrical grids. I have coauthored a conference paper in the past where I researched battery management systems for drones. I previously interned at a semiconductor company where I did software development. This summer I'm going to be interning at Western Digital working on data center solutions (probably will be heavily software based). I am interested in pursuing a masters in research fields such as energy, IOT or machine learning. I am probably going to have GPA between 3.3-3.4 by end of this spring. I will take GRE in few months. I am wondering if I have a chance of getting in considering most applicants will probably have very high GPA and come from more prestigious schools. Also is there anything I can do to increase my chances?

Edit. I was also an undergad teaching assistant for embedded control lab class",GPA requirements to get into masters in electrical or computer engineering?,t3_fzljgv,6.0,0.88,kpop5000
0.0,1586564747.0,1.0,caltech,What major should someone interested in finance pursue? Do you have to do econ or math or could you do something like chemistry?,How easy is it to get into finance at Caltech?,t3_fysn1z,1.0,0.53,forksrcool
0.0,1586279855.0,3.0,caltech,"Hi guys! I was thinking about applying to Caltech mechanical engineering next year. However, I have read online from various fonts that the workload is huge, that social life is rare to have and that people barely sleep there. I think this is exaggerated but it is just my opinion. Is there any Caltech student (mech eng or any other) who could give his opinion on this?

Do you guys enjoy it there?

How many hours do you study per week?

What is a typical weekend like?

Thanks a lot :)",Caltech Help,t3_fwofhk,3.0,0.81,teotav02
0.0,1586126078.0,27.0,caltech,"Hey!

I got an offer from Cambridge and recently got admitted to Caltech, and, while I am extremely happy about this outcome, this has got me in a bit of a dilemma. I would be very thankful for any input/experiences/opinions you might have, even if just about your feelings about US v. UK :)

I am an EU student, thinking of studying EE, currently leaning towards Caltech quite a bit!

**Caltech**:

Pros:

* More financial aid, so would be cheaper (nearly no debt after graduation)
* Many undergraduate research opportunities at places like NASA JPL, LIGO
* Unconditional offer
* Weather is much nicer
* Much smaller (could also be a con)
* Professors are very approachable
* Ability to take a minor in another subject

Cons:

* Very far away from home
* Located in suburbs, not a very ""student city"" feeling (I have not been on campus, though)
* Not such a diverse atmosphere (few international students, generally STEM majors)
* Not such a wide range of clubs

**Cambridge**:

Pros:

* Much closer to home (geographically and culturally)
* 4 years for a masters degree
* Very diverse atmosphere (a lot of international students, STEM among humanities, etc. majors)
* Cambridge is an amazing city
* Wide range of clubs
* Supervisions

Cons:

* Conditional offer (won't know if I got admitted for 100% until August)
* More expensive
* Not as much freedom in choosing what classes to take/switching majors, taking a minor
* Not as many opportunities for undergraduate research

Stay at home :)",Caltech or Cambridge?,t3_fvmxf3,27.0,1.0,KiloOhm
0.0,1585989170.0,11.0,caltech,"I was accepted into UW CS and Caltech and am not sure what to choose for CS. I am a residence of Washington but the tuition cost will not be my deciding factor. If I go to UW I could probably finish a year early since they accept AP credit and Caltech doesn't. I was wondering which school is better for computer science.

Edit:

Adding onto my question here's a little more insight as to what I'm looking for in my CS education (this is just a copy of the response I gave to hypercube42342 when they asked me what I was exactly looking for):

""My definition of better is more like at which school would I get deeper CS knowledge and experiences. Additionally, my goals are definitely to go into the corporate world after my undergrad and I am not interested in higher education like a Ph.D. So I guess the main traits that would be good for me are developing a strong CS foundation, being able to learn cutting-edge topics in CS like machine learning and quantum computing, definitely getting enough practical experience (I'm concerned by the focus on theory at Caltech), and lastly I'm also looking for getting good CS internship opportunities during the summer as well as research throughout the year.

My main concern in comparing UW to Caltech was that UW CS is ranked higher for CS than Caltech and that the UW CS department is getting a lot of funding."" 

Also by funding, I meant that UW is investing a lot into their CS department and they are hiring a lot of renowned professors who have significant publications.",UW CS or Caltech?,t3_fuq3ka,11.0,0.93,nd20029
0.0,1585540767.0,8.0,caltech,"I am wondering how important these are. I had applied for a few and gotten one but due to the COVID-19 situation, all of them this year have been canceled and next year have been put on hold. The only ones left are the ones for undergraduates. I feel really left out and don’t know how much this will impact my application.",How important are research attachments/internships at science institutions in high school for admissions into caltech?,t3_frju2k,8.0,0.9,Aryanlaw9
0.0,1585366972.0,21.0,caltech,"Hello! I was wondering whether Caltech is a good environment for pre-meds? Obviously the teaching and the research opportunities are amazing, but does the grade deflation make it insanely difficult to maintain good enough grades? And would you have to major in bio in order to feasibly complete the pre-med requirements? Do Caltech students get into top medical schools? What's Caltech's medical school acceptance rate?

(p.s. I posted this on CC too so please don't answer twice!)",Pre-med at Caltech?,t3_fqcnfh,21.0,0.87,curiouslyscience
0.0,1585104250.0,40.0,caltech,,Custom caltech plate frame!,t3_foipve,40.0,1.0,jumbodrawn
0.0,1585028101.0,24.0,caltech,"Hello, I am a physician in California who is looking for help with the coronavirus outbreak. We have an idea for utilizing our engineering colleagues to help us out.

Our problem is specifically how to minimize risk for viral transmission during airway management. Intubation is amongst the highest risk procedure for these patients, yet is necessary in critical patients. A Taiwanese anesthesiologist came up with a design for a simple cheap box for cleanable particle limiation. Please see the following for a basic schematic: https://sites.google.com/view/aerosolbox/design

I think it could be done better, and if engineered to be produced at scale could save a lot of healthcare workers. Please let me know if anyone on this subreddit would be interested in helping.

Thank you.
Brian Hondorp, MD

Edit:
Wow! Thank you everyone for responding, I wasn’t sure I’d get any responses.

Here are where I see the current limitations with this design:

1) Arm range of motion. Some patients, particularly those with “difficult airways” require more manipulation of the head in order to achieve a sufficient laryngoscopic view for intubation. A modification that allows for greater range of arm motion, particularly in the vertical dimension, while maintaining minimal aerosol exposure would be great. Specifically, the arm motion that would be limited by this box is head and neck manipulation to allow placing the patient in the “sniffing” position.

2) The top seam on the working side is in the direct line of sight. While not a deal breaker, it would be preferable to have ability to see through a clear panel that is perpendicular to line of sight, rather than potentially needing to look through a seam. Perhaps an angled panel would help? 

3) The bottom of the box is entirely open. It is necessary to have space to accommodate a variety of chest circumferences, as well as having space for an assistant to hand the Endotracheal tube, circuit, etc.  However, this potentially exposes assistants or other staff standing nearer to the foot of the bed to higher viral loads. I think an ideal solution would seal the bottom without being rigid. A surgical gown (or even a blanket) could be draped over the bottom for this purpose, but increases disposable costs and setup time. Is there a simple way to avoid this while providing better isolation for the bottom of the box than open air?",Physician call for help from engineers,t3_fnzqwv,24.0,1.0,[deleted]
0.0,1584992946.0,6.0,caltech,"Hello! It's me again :)

I was wondering how much, on average, students spend on rent, groceries, going out, etc.? I'm trying to see whether or not the stipend for my PhD reflects the costs of living in Pasadena.

If anyone could provide some sort of a breakdown, I'd really appreciate it!

Thank you!! :)",Cost of Living,t3_fnqkod,6.0,0.88,JesusLaden
0.0,1584992407.0,8.0,caltech,"Hey y'all! I'm a prefrosh and really excited to potentially come to Caltech in the fall. I know Caltech has a FSAE team, and I'm interested in joining. To those who are on the team/know people who are, what has y'all's experience been like? How much time do you guys put into the car, what facilities/funding do y'all have, and in general what is the team like?",Caltech FSAE,t3_fnqesb,8.0,1.0,mark-6
0.0,1584934756.0,14.0,caltech,"Hey, I'm a highschool senior who is having a difficult time choosing a college to attend. I'm interested in majoring in biology and the other two schools I'm deciding between are definitely not as prestigious as Caltech, but still relatively known for their bio/premed programs. I already visited the school and liked the campus, but I was wondering if there is anything important about Caltech that I should make sure I consider when making my decision. Thank you so much!!!",Choosing a college,t3_fndacz,14.0,0.9,blobinsonn
0.0,1584674282.0,34.0,caltech,"Today, the County of Los Angeles and the City of Pasadena announced a ""Safer At Home"" order that prohibits public and private events or gatherings of 10 or more people, and requires the temporary closure of all nonessential business through April 19.

As Caltech complies with the order, the Institute will build on the actions that have been implemented over the past several weeks to mitigate the spread of COVID-19 on our campus and in our community. Please see the linked memo for specific actions for undergraduate and graduate students, faculty, staff, researchers, and all members of our community. [https://www.caltech.edu/coronavirus#latest-update](https://www.caltech.edu/coronavirus#latest-update)","Caltech's response to ""Safer at Home"" order from County of LA and City of Pasadena",t3_flnqxa,34.0,0.98,caltechedu
0.0,1584674029.0,10.0,caltech,"Hello everyone!

I’ve been admitted to Caltech’s graduate program in Applied Physics, and am trying to weigh in my options (especially since the visiting weekend got canceled due to the COVID-19 situation).

I was wondering how graduate students find the social atmosphere of Caltech... are there a variety of things to do on campus or in Pasadena?

I’m also concerned about the size of Caltech. I actually like the small size, but am worried about being able to find people that I clique with. How has your experience finding a social group been?

Thanks in advance!",Social Life at Caltech,t3_flnovc,10.0,0.92,JesusLaden
