downs,epoch_time,score,subreddit,text,title,unique_post_id,ups,upvote_ratio,user_id
0.0,1613578852.0,10.0,caltech,"Hey y'all,

I was admitted to Caltech EA back in December and I have a few open-ended questions. I was looking into the research and extracurricular activities Caltech has to offer, and was wondering what y'all have done or currently do to maximize your experience at Caltech? What advice would you give to an incoming Caltech frosh that you wish you had coming into Caltech? Also, I'm interested in majoring in either mechanical engineering, electrical engineering, or computer science. Any insights regarding these majors? Lastly, how's the work-life balance at Caltech? I've heard that the classes are super rigorous, and was curious as to whether that plays a role in your overall happiness.

Thanks for taking the time to answer these questions, have a great day.",Taking Full Advantage of the Undergraduate Experience at Caltech,t3_lly6bm,10.0,0.92,columbiajacketboi
0.0,1613524047.0,3.0,caltech,Title pretty much. Have any of yall gotten in without chemistry?,"My UGrad AO messaged me saying that I never took chemistry (which is correct), asking if they were mistaken. Am I screwed?",t3_llifqk,3.0,0.72,Trick_Significance_3
0.0,1613446336.0,2.0,caltech,"While of course I'm going to be putting in my best effort, I'm still curious as to how critically the required SURF application research proposal is going to be judged, especially as an non-Caltech student (although I've got good letters and (I think lol) my mentor is excited to have me on). This question is prompted by the fact I haven't been able to put in as much time into it as I'd like these last two-ish weeks (family, school, and other stuff). I think a month is more than enough time but... maybe I'm wrong.",SURF Research Proposal,t3_lkurgq,2.0,0.63,AlmondMilkWrld
0.0,1613446242.0,0.0,caltech,"Hey guys,
I am currently in High School as a Sophomore, per the title. I have fallen head over heels for Caltech and I want to know the steps that you guys, as actual students (instead of the institution website), took to get in. Currently, I am (hopefully) taking an internship at the local planetarium and taking as many STEM AP courses that I can handle. What should I do on top of that to be accepted?
EDIT: Forgot to mention, I want to earn a PhD in Astrophysics",What should I do to have the highest chance of getting in Caltech? Coming from a High School sophomore,t3_lkuqeq,0.0,0.4,Aldebaran_086
0.0,1613436462.0,13.0,caltech,Also did you ever encounter any puzzles or codes you were unable to break?,What's your favorite memory associated with ditch day?,t3_lkrpe3,13.0,0.85,pygmypuffonacid
0.0,1613153798.0,1.0,caltech,"Has anyone here had trouble contacting Undergrad admissions? I’ve sent them emails and called, but to no avail.",Contacting Undergrad Admissions,t3_lih1dm,1.0,0.6,mellowdrosophyllum
0.0,1613108317.0,0.0,caltech,"I'm so damn anxious since the application results are not out, and I hear that the CMS and MCE visit days are very close. Does anyone have any clue about the visit days for Space Engg.? If there aren't any, have the interviews begun? Is there a possibility of being given an admit directly?",Visit Days for Space Engineering,t3_li4pcp,0.0,0.5,TheUniqueOne_v2
0.0,1613088793.0,1.0,caltech,"I’m an undergrad transfer applicant with a few questions.

1) now that COVID-19 exists, does Caltech accept PDF official transcripts? I called them and it seems no one is in the office. So, I got my current school to send an official pdf form as well as a physical copy in the mail. 

2) if anyone else is using the Coalition app, how exactly do we submit external research papers/docs? I don’t see a place for it",Questions about undergraduate transfer,t3_lhyv81,1.0,0.67,mellowdrosophyllum
0.0,1613082551.0,3.0,caltech,I applied to the caltech mechanical engineering phd program. Anyone know when they release their acceptance letters. The site says march but alot of schools release letters early. Anyone know? Also do they do interviews?,Engineering Phd application,t3_lhwn88,3.0,1.0,hateley123
0.0,1613004138.0,24.0,caltech,"I was recently accepted to the Caltech applied physics Phd program (very excited!) and I have a whole slew of question about grad student life. These are all pretty generally, so any insight is super helpful!

1. Do people seem happy? Do they generally like the research environment? How about the community? 
2. What are the pros and cons of the smallness? Does the community feel more connected? Does it feel limiting? (I'm used to a large school). 
3. Does Caltech take good care of their grad students? Is the healthcare good? Do most grad students want to live in campus housing, and are they able to? Is there a union? 
4. Is the school pretty social? Do people make a lot of friends outside their department? Do most students mostly engage with the school community, or are they more integrated with Pasadena? Does the \~2:1 grad student gender ratio affect dating? 
5. Anything else you like / don't like, or that a prospective grad student should know? Anyone know anything about APh / physical science specifically? 

Thanks!",A Bunch of Questions about Being a Caltech Grad Student,t3_lh8ly9,24.0,1.0,OfSomePersuasion
0.0,1612919846.0,8.0,caltech,"I’ve always heard that CalTech is known for having the “party nerds” crowd. I’ve been wondering if the stories are exaggerated, or only true for a minority of the student body, perhaps.

Specifically, I’m curious about things like premarital sex, alcohol and drugs and profanity. (Especially the first one).

For context, CalTech was always my dream school, although I couldn’t even apply for undergraduate due to various circumstances. I’ll relatively soon be graduating and am considering CalTech for my Masters/PhD. However, especially with recent events, I’ve realized how much I dislike being alone.

It might be my last chance to make friends and try dating and looking for a potential life partner. So, I’m curious what the culture is on campus and how many other people have similar values.

To clarify, I’m not ultraconservative or anything. I don’t mind if you do drugs, drink alcohol, or cuss every other word. I won’t hold it against you, you’ll still likely be a friend, I just won’t do so myself. (This would however be a turn off for a potential spouse).
My greatest concern is that I would potentially try dating someone and enter into the relationship with different expectations, potentially breaking someone’s heart, and/or my own.

Sorry if my question was vague or roundabout. I’d appreciate if any students or alumni could enlighten me regarding the campus culture. Thank you in advance!",How Liberal/Conservative are most CalTech Students in regards to Traditional Values?,t3_lgijy5,8.0,0.75,DE128
0.0,1612504164.0,2.0,caltech,How hard is the Caltech transfer exam?,Caltech Transfer,t3_ld0nut,2.0,0.57,Scoundrel_101
0.0,1612331767.0,1.0,caltech,"Hello all!

I'm a HS Senior (intl), applying to Caltech for the RD wave. I binged Caltech's CS 156 on YouTube and enjoyed it a lot, and I love research, and it's my absolute dream university. I have a lot of unresolved questions, since unfortunately there's a relative lack of Caltech-specific resources online. If you could help with any of these, I would greatly appreciate it!

\- Caltech's website lists CS as their most popular major - how much has this changed their focus throughout the years? How engaging is Caltech's pure CS program? On a forum in Quora, someone said they didn't even offer NLProc. This was from \~2004, what would a 2021 rendition look like?

\- What has your experience been with Caltech's core curriculum? How does it progress from freshman through senior year? (Rephrased: At what point in your undergraduate career do you dive headfirst into your major?)

\- How accessible are graduate students and faculty at Caltech? Can I engage myself conducting research under the guidance of professors outside of SURF?

\- Is ML/AI at Caltech theory focused? What sort of projects would one undertake at Caltech? Can I use Caltech's servers as free real estate for training neural networks?

\- I'm also interested in cybersecurity research, what opportunities could I take advantage of at Caltech incoporating infosec?

Thank you so much for your time and advice!",Caltech Undergrad ML/AI - A few questions!,t3_lbgyy8,1.0,0.56,codeinassembly
0.0,1612309493.0,9.0,caltech,"Hello everyone,

I am a non-Caltech student applying for Astronomy/Physics SURF this year. Based on the website, 85% of applicants get accepted every year. 

My question is who determines the admission of SURF?  The Caltech faculty mentor or the the admission committee? How do I maximize my chance of getting in? 

Will this SURF increase my chance in getting into Caltech for grad school when I apply next year? And can you please provide some suggestions for getting into Caltech for Astronomy PhD? 


I truly appreciate your help.",SURF,t3_lba3zn,9.0,1.0,li37483
0.0,1612286909.0,2.0,caltech,"I'm applying for SURF this year but I'm curious regarding the possibility of the entire project being virtual (something I'd hate). What are the odds that I, as an international student, would be able to come to campus for research during summers? Or will it probably be virtual because of COVID-19",Will SURF take place on-campus or virtual for international students?,t3_lb17hf,2.0,1.0,space-skipper
0.0,1612188950.0,7.0,caltech," How can I get the list of all the textbooks used in undergraduate level Physics at Caltech?
 I just want the list of textbooks they use here! Can I find them online ? 
Last week I asked via caltech's FAQs email named smora but no one replied!",Ug Physics textbooks,t3_la3zgs,7.0,0.89,diracsDeltaFunction
0.0,1611764883.0,9.0,caltech,"Anyone here doing aerospace engineering? Just a high schooler looking for suggestions about how to get involved with aerospace kind of stuff. I've loved, literally loved, planes and rockets for as long as I have memory so any tips in a PM or comment would be really really helpful.

Also - I know think Caltech runs NASA JPL (correct me if I'm wrong plz) so why doesn't have Caltech have an aerospace engineering undergrad major? idk it just seems kinda strange

Thank you in advance :)",Aerospace Questions,t3_l686zu,9.0,1.0,Far-Term8667
0.0,1611717632.0,2.0,caltech,"Hello! Does Caltech have any graduate programs that are masters or business or engineering specific?

Currently a working professional in tech for 10 years with an undergrad degree - interested in applying. However, the only programs I see that are somewhat similar were the provided PhD programs.

If anyone has any information that they can share, that would be great!

Thanks ahead!",Cal tech Masters or MBA Program,t3_l5v48z,2.0,1.0,Let-Maximum
0.0,1611681858.0,7.0,caltech,"From what I've heard, the focus is mostly on research and PhD's, but how often is it that Tech grads go on to get an MBA / move into management, either soon after graduation or further down the line?",Does anyone from Caltech (esp in CS / Math / Eng fields) get an MBA?,t3_l5ipo2,7.0,1.0,Zealousideal-Post-39
0.0,1611392228.0,12.0,caltech,"Hi folks, I’m a prospective PhD student planning to visit campus tomorrow to see what it’s like.

I found a self-guided walking tour online, but I’m wondering if you have any personal suggestions on what to see while I’m here. I’m interested in your favorite spots at Caltech, as well as in Pasadena. (Of course, I don’t expect to enter any buildings because of covid).

Thanks in advance!",Self-guided campus visit,t3_l38qqw,12.0,1.0,UAG_it
0.0,1611358071.0,10.0,caltech,"I was invited to interview at Caltech next month for bioengineering PhD program and I'm wondering what doing research at Caltech BBE is like!

Caltech has always been my dream school since I have switched from automotive engineering to bioengineering. Most of my ""science crushes"" are at Caltech as well.

What is it like doing research at Caltech BBE (or other programs)? What do grad students do during their free time? (Planning to get a pilot license lol not sure if that is manageable considering that I also spend a lot of time on my car, for pleasure driving)

Gosh thinking about the fact that I actually have a chance to do science Caltech makes me smile every time! Plus the amazing canyon roads around LA lol.",Caltech Bioengineering PhD questions,t3_l2zwt2,10.0,0.92,PapaSeanL
0.0,1611077985.0,7.0,caltech,"I'm a high school student hoping to go to Caltech fall of 2022 and I'm doing some research to figure out a plan for how to do that

one of the big things is I live in Missouri so over the summer I wouldn't have anywhere to live unless I rented an apartment or stayed at Caltech 

over the summer I'm hoping to get an internship at SpaceX and/or do some research work at Caltech 

so I'm trying to figure out if I would be able to stay in one of the houses over the summer in between semesters 

and if it is - is it better to just get an apartment anyway? a lot of the financial stuff for Caltech is confusing and I'd be going with very little money so if one is cheaper that would be great I'm just not sure

if anyone can help that would be great",is Caltech housing available over the summer?,t3_l0otey,7.0,1.0,MR-BOW-TIE
0.0,1611028619.0,19.0,caltech,"Hey, not sure how appropriate this is for this sub, but this is a direct opportunity for Caltech students only. I'm a Caltech grad student and for the past few years I've been tutoring some local students on the side for extra cash. I'm moving on to the great beyond, but the person who organizes (Pasadena resident and mom of kids in Pasadena schools) is looking for other Caltech students. Pays $30/hour, all remote, mostly middle and high school kids learning math and intro programming. As much or little time commitment as you want. PM me if interested and I can provide more info and possibly put you in contact. 

I have zero financial or personal interest in people taking this up. Just wanted to pass on the opportunity if anyone is interested.",Pasadena Tutor Opportunity,t3_l0bmx7,19.0,0.96,Horror-Limit-6670
0.0,1610861735.0,9.0,caltech,Hi! I’m a non-Caltech student interested in applying for SURF this summer. Could I PM someone who has done the program before? Thank you!!,SURF,t3_kz0ex9,9.0,0.92,soslskskskskjsjs
0.0,1610731550.0,28.0,caltech,,Naming And Recognition Committee Recommendations,t3_kxz77f,28.0,1.0,StarsInTheMoon
0.0,1610510869.0,4.0,caltech,Pretty much the title. I want to submit a stem research paper I have done since the application deadline during the feb. update.,Can you submit a research paper during february update?,t3_kw8lw5,4.0,0.84,Trick_Significance_3
0.0,1610321035.0,8.0,caltech,"Hi! I'm a prefrosh and I was wondering what majoring in mathematics at Caltech is like. 

Through info sessions and q&amp;a's, I've heard a lot about how easy it is to get research opportunities and how most students research at some point but I was wondering what that was like for math majors. As far as I understand (which isn't much tbh), mathematicians need to do a lot of coursework and build foundations in a lot of different branches before they actually start researching. 

So, are there significant research opportunities for math majors or do they mostly just take specialized courses and attend seminars? I've heard a lot about SURF but I'm not sure if that's geared more towards other majors. 

Also, if I did take relevant electives in other areas like chemistry or data science, how difficult would it be to try to research in those fields?",Research for math majors,t3_kupt4w,8.0,0.91,MySummerOnAWinterDay
0.0,1610121178.0,9.0,caltech,"Hey, I'm a theoretical Physics major from a European uni and through my school's exchange programme I got accepted to go to Caltech next year, i.e. senior year for me. I had a few questions for you guys, some more specific, some more general:

* What's the workload like in senior year, especially in physics? I'm not too worried about grades, since all the courses become pass/fail for me, but I've heard some people say that senior year is more chill than junior year or something like that.

* What's the exchange student experience like in general? Does anyone know any past exchange students I could get in contact with?

* How bad are the exams? At my school there are only end of course exams, so a few each semester, and generally the split is 80% exam, 20% coursework for the grades. How do Caltech's exams compare in frequency and in importance?

* Are there any really cool courses I should take? I'm not too much of an astrophysicist, but I'm open to suggestions.

* How necessary is it to have a car? How good is biking for getting around?

* As far as I understand, I'd be staying in residence halls if the coronavirus situation permits. How are they and what kind of facilities can I expect?

* Similarly, has there been any communication as to what the next academic year will look like?

Sorry for all the long questions, I'd really appreciate it if you could answer them. Hope to see you all next year.",Exchange student experience,t3_kt55rk,9.0,0.92,Raikhyt
0.0,1609880913.0,10.0,caltech,Does anyone living near Caltech have a bike they are willing to give/sell to me for cheap? I am an ug and don't want to buy a car,Bike,t3_kr7umu,10.0,0.86,gibdit
0.0,1609680579.0,19.0,caltech,"What are reasons someone SHOULDN’T consider Caltech? Specifically, what are the negative aspects of the school?",Why NOT Caltech?,t3_kpkmu0,19.0,0.91,MyChipmunkHasStripes
0.0,1609528509.0,6.0,caltech,"Hi,

So I was wondering if SURF and SURF@JPL were summer research programs that students conduct by themselves, or are they allowed to do them in groups?",Is SURF a Group Research Project or Individual?,t3_koh1gm,6.0,1.0,Changster101
0.0,1609388474.0,17.0,caltech,"Idle questions: Is “The Ride” still played? Is the Honor Code still taken seriously? Are there fires in the firepit at Blacker (or was that Dabney?) Cheers, Jeff (Lloyd)","Eh, I would have been Class of ‘80 if I hadn’t flunked out.",t3_kniqg0,17.0,0.91,Ghostweed2
0.0,1609277227.0,0.0,caltech,"As a prospective student, I would like to know how sustainable CalTech is. I did have a look at the website but couldn't find all the information I was looking for. Is there some sort of compost, so that biodegradable things can get recycled? Does the university grow any fruits/vegetables on campus?

I hope someone here can help:)",How sustainable is Caltech?,t3_kmndw9,0.0,0.5,Illustrious_Daikon23
0.0,1609253329.0,13.0,caltech,"I’m definitely committed to applying to Caltech as an undergrad next year because I find the devotion to STEM and heavy research environment to be incredibly inspiring. I’ve done research in various fields of chemistry and biology over the past few years and have discovered what I really like. I adore organic chemistry but also have a strong affinity and passion for neuropharmacology and computational neuroscience. So much I’d like to end up and do R&amp;D in medical science and drug therapy (I don’t intend on going to medical school in the future). I’m not sure, but I’m considering a prospective major in CNS. Is there something more relevant that Caltech offers that I may have overlooked? 

Thanks :)",Is there a program that’s best for me?,t3_kmfrqk,13.0,0.93,nikathesibe
0.0,1609252218.0,2.0,caltech,,"Were graduate programs like space engineering offered online before the pandemic? If not, do you think they will continue to be offered online if/when the situation has improved?",t3_kmfgej,2.0,0.75,Dlrlcktd
0.0,1609028505.0,7.0,caltech,Title,Does Caltech regular decision application offer a chance to submit STEM research portfolios?,t3_kktbch,7.0,0.9,Trick_Significance_3
0.0,1608911522.0,7.0,caltech,Does Caltech have a Discord?,Caltech Discord,t3_kk12qt,7.0,0.9,Bunniessszz
0.0,1608697075.0,9.0,caltech,"I'm a non-Caltech student trying to apply for SURF and I can't find a way to contact the program with application questions. (I also can't find the application, which is a whole other thing, but whatever.) Does anyone know how I can email them?",SURF Contact?,t3_kilwqk,9.0,0.91,babygeologist
0.0,1608676775.0,9.0,caltech,"I just wanted to know if there is an art club at Caltech as art is a big part of who I am. I do know Caltech is more, well, tech oriented but lmk please!

thanks :)",(Undergrad) I really love art and engineering so I was wondering if there is any art club or art+tech club at Caltech?,t3_kifwat,9.0,1.0,_changloriousbastard
0.0,1608625825.0,42.0,caltech,"Do you have a question about what to write in your application essays? Or about what GPA and test scores are necessary to get in? Maybe you are not applying in the immediate future, but you would like to know what you can do to boost your chances of getting into Caltech.

If these are your questions...**please don't post them here!**

The people on this sub are not admissions officers. They are mostly current students (undergrad and grad) and alums who haven't been through the Caltech admissions process for years. 

**If you would like to discuss admissions with other students going through the process**, please instead go to the following subs:

* /r/applyingtocollege for undergrad admissions
* /r/gradadmissions for grad admissions

Other good tools for answering your questions include the [Caltech admissions website](https://www.admissions.caltech.edu/) and [simply Googling](https://google.com) your question. 

On the other hand, **this sub is welcoming to specific, thoughtful, well-researched** questions. Most of us found our time at Caltech to be highly rewarding, and we would love for you to share that experience. **Here are example GOOD admissions questions:** 

* (Undergrad) I am thinking about applying to Caltech, but not sure whether there is a program which suits me. I want to learn about both pure and applied math. I read in the catalog about the math major and the ACM major, however the former seems to pure and the latter seems too applied. Is there a way I can do both?
* (Grad) I want to do research in quantum computing and have heard great things about the Vidick group. Does anyone know whether he is accepting students, and more generally what the research environment in his group is like? I have a chronic illness so I am looking for an advisor who is understanding when I need to take time off. 
* (Either) Does Caltech have an active basketweaving community? On the Caltech club list I found a link to a club website, but it hasn't been updated since 2007.",Have an admissions question? Look here first!,t3_ki1f0n,42.0,0.97,literally_mental
0.0,1608560769.0,4.0,caltech,"Hi! I am planning to apply to Caltech in the regular action cylce and It is the last college left that I did not submit my application. After getting deferred from MIT's early action, I looked more carefully into Caltech with a different perspective than before and I am genuinely interested in the school. But I have to admit that I am a terrible essay writer and I truly want to try my best in the Caltech prompts. Would anyone like to talk with me to share their experiences in Caltech and provide some guidance with my essays?",I would like to talk to someone about how to approach the Caltech essays,t3_khie6e,4.0,0.67,hallederikyau
0.0,1608302375.0,5.0,caltech,"Hi I’m a prefrosh looking to major in ACM at Caltech, although I am open to CS or Physics. Hoping to do something in data science and/or ML, but that could be anything from quant finance to environmental tech startup to JPL research. 

- How easy is it to major in ACM (lots of requirements, etc)? Can i doably double major in BEM if I want, or would that not be worth the effort?
- What are the benefits/drawbacks of ACM vs studying CS or Physics?
- Is interdisciplinary research welcomed, or do kids tend to stay more strictly within their field (eg  I would be interested in ML research at JPL)?
- Are students encouraged/inclined to take classes outside the scope of their major?
- How are the general job and grad school prospects for ACM majors (masters probably in data science-related field or even MBA)?


Thank you for your help!",ACM major- job prospects and flexibility,t3_kfma1q,5.0,1.0,Cute_Industry_3525
0.0,1608276313.0,7.0,caltech,"Hey Everyone! I hope break is going well.

I'm a frosh and looking at potential SURFs (in Astronomy/Physics/Planetary Science). I've found a few I'm interested in and have realized that several faculty are heads of or part of a research group. Is there a place where I can find a list of these groups and labs?

Thanks! :)",List of Labs/Research Groups,t3_kfgk6v,7.0,0.9,l22jordan22
0.0,1608180005.0,8.0,caltech,"If so what was your experience with it and was it worth it? Just trying to figure it how viable the path is and if its worth spending 5 years and extra money to do.

Feel free to answer even if you didn’t do it but have useful info! I have found that information on the program is limited (one reddit thread claimed that usually no more than 1 student in an entire class does the program, and that Caltech was rejecting Reed students with 3.9 GPAs as they just dont have enough space for everybody), so any additional information would be great!",Did anybody transfer here from Reed or any other colleges participating in 3/2 programs with Caltech?,t3_keqh6z,8.0,1.0,DinoTrucks77
