downs,epoch_time,score,subreddit,text,title,unique_post_id,ups,upvote_ratio,user_id
0.0,1553310946.0,3.0,caltech,"Hi there! 

I'm a recently admitted Prefrosh who's looking to major in either ChemE or BioE. I was wondering if I could receive some advice on which to pick.

My goal is to develop and implement a more effective drug delivery system using nanorobotics; essentially tapping into the work of Dr. Qian and others and applying it to therapeutics. To do this I'd like to do research during the school year every year.

I'm struggling to pick between these majors because there are few cons to each of them from my perspective:

Cons of BioE:
- pays a lot less for just a undergrad degree, which is relevant to me because I need to pay down 80k of student loan debt between undergrad and getting a PhD. A lower paying job means more years between undergrad and PhD.
- Maybe be harder to get a job in the pharmaceutical industry between undergrad and PhD.

Cons of ChemE:
- I have to take a few courses Im not personally interested in.
- the courseload for ChemE is far more extensive, meaning that I'd have to take at least 5 courses every term for every term in my four years. I worry that this will impede my ability to get meaningful research done during the year. 

I know this is a long post so I appreciate any advice! Hopefully someone will correct a misunderstanding I might have in my cons list, or perhaps suggest an optional way forward. 

thanks! 

",ChE or BE at Caltech,t3_b4e9k6,3.0,1.0,Enoxxy
0.0,1552574608.0,7.0,caltech,"Greetings!  I am a second year PhD student in Space Sciences at Florida Tech, and I received a 10 week internship at JPL for the summer.  I have the option of staying on campus during this time.  It looks like there is a shuttle that runs from Caltech to JPL and back throughout the day?  The only information I could find on this is from 2011, so I am worried about it being out of date.  I'm trying to ensure that I could survive living near Caltech without a vehicle for the ten weeks, relying on this shuttle and other public transportation (in addition to a bicycle) to survive during the summer.

Does anyone here have any information or advice for me?  Many thanks in advance!",Shuttle to JPL in summertime?,t3_b11558,7.0,0.9,Two4ndTwois5
0.0,1552527911.0,11.0,caltech,"There's A LOT of pressure on people to become more ""normie""/normal (and less quirky) over time, and I sometimes fear that the strong culture feels also get ""lost"" over time. There are some aspects of the school that really do seem more exciting than the more ""normie"" real world.",Do Caltech students stay quirky/non-normie after graduation?,t3_b0ugek,11.0,0.87,inquilinekea
0.0,1552470671.0,10.0,caltech,"Based on Quora, I've heard a lot of times, but Quora could be an untrustworthy website. If so, do you still get all A's?",How often do Caltech students skip class?,t3_b0k4li,10.0,1.0,FailureAtLife123
0.0,1552434027.0,11.0,caltech,...do they have stickers? ,Admitted Students: does Caltech send out physical acceptance letters,t3_b0ew6e,11.0,1.0,potato421729
0.0,1552414121.0,12.0,caltech,I am an admitted RD student and am concerned about the social atmosphere. Is everyone there super awkward and  competitive? Is your day filled with endless homework or is there a good balance? ,Admitted student q’s,t3_b0ayry,12.0,1.0,gibdit
0.0,1552324532.0,17.0,caltech,"Hi! I am super happy that I was accepted to Caltech RD this year. I will admit, however, I didn't know that much about the school going in and am a bit off-put by all of the threads about how stressful undergraduate Caltech is. I would like to know which of the following statements are exaggerated, which are true, and strategies for managing the latter.

&amp;#x200B;

\- Little/No Free Time

\- Bad Administration policies (heard rumblings of this but don't know the specifics)

\- Prestige of the Caltech brand offset by a less-than stellar undergraduate GPA due to course difficulty (when applying for a job or graduate school) (I have heard people citing this when referring to Caltech as a ""huge gamble"")

\- Professors not focused enough on teaching due to being active researchers

\- Lack of social life / visiting LA and such 

\- Lack of safety-net 

&amp;#x200B;

Please note that my overall impression of Caltech is positive, and as I said before, I am super happy to get in. However, I am potentially spending four years of my life there and would like to have my reservations cleared up if possible. Thanks :)",Reservations about Caltech,t3_azvzb7,17.0,0.96,potato421729
0.0,1552184626.0,20.0,caltech,"First off, congrats on being admitted of class of '23! You should do two things: Join the class of '23 facebook page, but more importantly, join the Prefrosh meme page (Caltech Prefrosh Memes for Rotation Rules Compliant Teens on Facebook)!

^^^please ^^^join ^^^I'm ^^^an ^^^admin ^^^and ^^^the ^^^only ^^^one ^^^posting ^^^recently ^^^and ^^^I'm ^^^lonely ^^^send ^^^help",Suggestions for Recently Admitted Prefrosh,t3_azb3nz,20.0,0.87,nowis3000
0.0,1551766102.0,8.0,caltech,"I'm going to be SURFing at Caltech this summer as a visiting student. I have some questions:

a) should I go for the on-campus housing? (also, is it possible to get placed in a double and not a single?D:)

b) how do surfers acquire food?

c) what do surfers do for fun over the summer, when i assume most normal campus events are dead?

d) how can i make friends who might be doing surf before i get there?

thanks!",Caltech over the summer,t3_axhs84,8.0,1.0,Rock_Pineapple
0.0,1551526121.0,8.0,caltech,,A suggested walking tour of the Caltech campus. Commentary encouraged.,t3_awgvug,8.0,0.79,dodli
0.0,1551463593.0,5.0,caltech,"I plan a self-guided tour of the Caltech campus. I use Google Maps Street View to plan my route. There's a small part of the route that isn't available on Google Maps. Could you please help me out?

Across the street from the main entrance to the Sherman-Fairchild library there are gates leading to a court.

1. Are these gates normally open?  
2. Is it possible for a visitor to access this court by entering the Dabney Hall from the other side (the side that faces the Parsons-Gates Hall of Administration)?  
3. What times is the Dabney Hall open for visitors, so I can make this shortcut?",From the Parsons-Gates Hall of Administration to the Sherman-Fairchild library via the Dabney Hall,t3_aw7s66,5.0,1.0,dodli
0.0,1551323380.0,6.0,caltech,"Looking at an application for undergraduate engineering/physics (quantum/nuclear) degree.

Is it true that Caltech is very research/funding based (obsessed!?) an UNDERGRAD level?

My son is interested in attending - very lateral/design focused, not research so much. Loves the idea of being with hardcore and focused scientists like himself. Lots of brainstorming, ideas, trying things out ... he'd be in the stage before it gets to formal research.

Would that approach fit at Caltech too?",Caltech at Undergrad level? Research Obsessed?,t3_avm4q3,6.0,0.81,carlareams
0.0,1550651575.0,9.0,caltech,"I am a prefrosh admitted under EA. I have a few choices for college and have a few questions to help narrow down my selection. Feel free to answer as many or as few as you want:

1. When do you usually sleep? On average, how many hours of sleep do you get each night?

2. What are the most active clubs on campus, especially pertaining to astronomy or aerospace? The amount of student organizations at Caltech seem significantly lower than most schools and only seem to be dwindling... does it feel that way?

3. How much background do freshman classes assume you have? Is it possible to do well with a below-average high school foundation?

4. Why did you choose Caltech? Was it worth it? If you have to cite a single reason for staying away from Caltech, what is it?

5. How are the humanities? Students I've talked to described the humanities as ""science lite,"" that economics is mostly game theory and history deals with the history of science. How true is that? Are there really no ""real"" and more traditional history classes?

6. How detrimental/ beneficial is Caltech for grad school admissions, especially for a middling student? Does Caltech accept its own undergrads to their grad school?

7. If you had the choice between MIT and Caltech, given everything you have experienced and ignoring weather, what choice would you make today? If that choice is between Stanford and Caltech, which would you go with?

8. What do you feel differentiates the House System at Caltech from residential colleges or dorms with strong dorm cultures at other institutions?

Thank you!
",Prefrosh Questions,t3_aslyck,9.0,0.92,hhhahah
0.0,1550518155.0,1.0,caltech,"I have been researching good engineering schools and CalTech has popped up quite a bit. I do like the student to faculty ratio, I also like that CalTech has a good reputation in the industry.

However, I did quickly note that it is extremely difficult to get into the school, especially as a transfer. I would like to know what I can do to help my chances of getting in. My background is that I'm planning to earn my AA degree with a focus on math and I'll strengthen my math skills outside of class. I am currently a high school senior so I can't really do much except sign up for math boot camps at the CC I'm going to. Any advice is appreciated, be it habits I would need to build, classes, etc.

**IMPORTANT TO NOTE**

**I am from out of state**

**I do have weak math skills, but I would love to be an engineer**

**Am considering mechanical engineering or electrical (quite different I know)**",Transfer Preparation (Engineering Major),t3_as0z3b,1.0,0.67,MustangKnight07
0.0,1550449971.0,8.0,caltech,"So I’m from Texas and compete in science UIL, at our last meet I placed first in chemistry and physics out of about 100 students from nine different high schools. 


Should I update Caltech about this or is it not important enough and or do they not accept updates this late? 


Edit: Mentioned I’m from Texas because UIL is a Texas competition ",Should I send an update to Caltech about some recent local awards? (RD Applicant),t3_arr4bk,8.0,1.0,Matthew_B1
0.0,1550339032.0,4.0,caltech,"I’m a high school sophomore, and when I was looking at some XC/Track page for MIT, I saw that mile time had to be under 4:37, which I’m not totally sure I can get by the end of senior year. However, I’m very committed to running, and I don’t know what I’d do otherwise. Is there a club at Caltech that a lot of slower people are in or something? Or is it small enough that anyone who wants to be is on the team?",What are the XC/Track requirements?,t3_arb1ul,4.0,1.0,Giratinalawyer
0.0,1549548794.0,6.0,caltech,"How many legitimate clubs with a decent size and purpose are there here at Caltech? I feel like almost every club I've tried out is either run by one extended friend group or only has &lt;10 people, and they all share the general trait of being run in a very informal, but borderline unprofessional, manner.... that is if they don't disband after a year or two.

I've heard the other institute of technology has Traders, Sloan Business Club, Splash, HMMT, a consulting group, etc. I hate to be making comparisons all the time, but is there anything of that flavor here? I'd love to know. Thanks",Clubs at Caltech?,t3_ao44k5,6.0,0.88,[deleted]
0.0,1549499080.0,5.0,caltech,"Im a HS sophomore in California and I have a gpa of 3.86 and im planing to do AP physics next year and AP chem this summer. Btw i don't have much extracurricular activities, but i do love astronomy and physics. What i need to do to improve so i have higher chance to get in clatech?",any advice for a hs sophomore want to apply to caltech?,t3_anxonv,5.0,0.78,[deleted]
0.0,1549463362.0,3.0,caltech,"Hello! I am currently an undergraduate university student in Canada studying Geomatics.

I have a ton of questions to ask, so if someone can PM me to answer them, that would be very much appreciated!

It would be a bonus if you were also from Canada and in the division listed in the title, but all advice is welcome.

Thank you!",Graduate Studies and Admissions (Geological and Planetary Sciences),t3_anr81d,3.0,1.0,korean_chad
0.0,1548136667.0,9.0,caltech,"Hello and thank you for reading/commenting. I was recently admitted into the CalTech chemistry PhD program, and I am concerned about some of the rumors I've heard. I understand that the program is competitive and demanding in the number/quality of published papers that Profs. require for graduation. However, are Profs. and the culture generally accepting and supportive of colleagues who have a little more work-life balance while maintaining high productivity?

Do most labs have students staying late and working on the weekends every single week? How competitive/collaborative is the general culture there? Are students generally happy? Do students feel generally fulfilled and satisfied? Can students balance relationships with friends/family/SO? I'm happy to work 60 hours a week, but I like doing it at on my own schedule without worrying about appearing busy. I'm competitive enough to work hard to deliver a substantial number of results relatively to my peers, but I hate to sacrifice quick, day-to-day activities that make me happy just to appease my boss or work culture. Do students generally have a good dynamic between each other, or do students get butt hurt at each other, depending on whether or not they are making progress on their projects? Are students generally over-boasting about their work on their published works, or are students generally humble about sharing credit and working together?","Chemistry PhD Grad School Culture...highly demanding, or reasonable?",t3_aijuae,9.0,1.0,chemicallyspeaking
0.0,1547664187.0,4.0,caltech,"short: I will be working at Caltech for the summer and I need a place to stay that is (hopefully) within 1.5 miles of campus. I am open to any type of housing - a room or a full apartment/house. I am a student, so my budget is kind of sad. Dates are flexible, but will be at least 12 weeks from the end of May to August. let me know of any offers or other people to contact. thanks! 

&amp;#x200B;

long: hi, I am a junior at Harvey Mudd College and I will be working in a lab this summer at Caltech. I was there last summer as well, and finding short term housing was a real pain. I am okay walking a bit (last year I was about a mile and a half from campus) but if the place is far, I would prefer somewhere that is closer to old town. I am pretty flexible with dates right now, but I would prefer something that starts towards the end of May and goes to August. Budget is kind of small but please let me know of anything that is available. :) let me know of any offers or questions or other people to contact. thanks!

&amp;#x200B;

(about me: I'd classify myself as a good roommate -- clean but not overly clean, cool but not too cool, etc. I am a female with she/her pronouns and I am open to any roommate who isn't an asshole. I am respectful to other people's property, I promise )",looking for summer housing near caltech,t3_ago91w,4.0,1.0,anonymous_carpet
0.0,1547525607.0,7.0,caltech,"Hello, I got accepted Early Action and I am registering for the Prefrosh Experience in April. My parents were not sure if they should come or if I should go on my own. Is there stuff for parents to do during the PFE or is it not worth it for them to come? We are around 700 miles away from Pasadena.",Prefrosh Experience Questions,t3_ag4k7g,7.0,1.0,Agstralia
0.0,1547451851.0,6.0,caltech,"Hi, prospective transfer applicant.  Have a couple questions about the process that I'd love to PM current students (or recent grads).

Thanks in advance!",Any transfers here?,t3_aftixn,6.0,1.0,caltechquestions
0.0,1546680116.0,2.0,caltech,I didn't take chemistry in high school. Am I guaranteed no undergraduate admission?,Undergrad with no Chem?,t3_acsomr,2.0,0.76,[deleted]
0.0,1546419733.0,3.0,caltech,"I'm doing well with a GPA of 4.0 and have taken up to ODE and 3 classes of college-level physics.  So far I'm pretty confident that I have a very steady knowledge in Math and Physics.

I don't have many extracurricula activities. I'm a member of the Greek society and do occasional volunteer stuff, but not that much of an outstanding ""activist"".

I'm having quite a good connection with the STEM faculties in my current school so I may be able to ask them for a good letter of recommendation.

From what I heard, there's only about 8 transfer students accepted each year. Will I stand any chances of getting in Caltech? I'm a Physics major btw.",Any chance for a community college transfer student?,t3_abrptb,3.0,1.0,hi_amdk
0.0,1546387593.0,5.0,caltech,,"If you took courses at your local university, do I need to send a transcript from them to undergraduate admissions?",t3_abnng1,5.0,0.86,anshshard
0.0,1545951221.0,4.0,caltech,"I want to major in CS. Double majoring is pretty common in other universities, so how is it at Caltech (besides humanities double majors e.g. BEM)? I've been looking through the option requirements. I noticed that MechE has fewer requirements than other options like ACM. Is it feasible to double major in MechE and CS? If it isn't how is double majoring in CS and ACM? There seems to be a lot of requirements for majors at Caltech...",Double Major in CS/MechE or CS/ACM?,t3_aa46yg,4.0,0.83,CoffeeBean123
0.0,1545931011.0,2.0,caltech,Does anyone know if it’s open? The website doesn’t say but last time we drove out it was closed due to snow and ice... didn’t want to do another 2 hour drive for nothing. ,Mt Paloma’s observatory open today?,t3_aa11uf,2.0,1.0,sprashoo
0.0,1545336233.0,2.0,caltech,"In the Common App for Caltech, it asks for ""What do you like to do for fun?"" and mentions the prank culture.

I've finished all my other essays for all other universities but this one. What the hell am I supposed to do here?

I'm an overall boring, quiet and quite uninteresting person. I don't do much socializing and spend most of the time reading, playing music and studying. I'm not a quirky person, but I do believe I'm not anti-social, just a bit recluse. And I understand that the whole purpose of the question is to show you're not ""all work, no play"", and I'm not, but I just don't do anything but boring stuff to pass time.

This thing is killing me. I can't for the life of me even imagine what I could put here that wouldn't sound trite or fake, and I'm not funny enough to make up something here. Do you guys have any indication of what to write here?","boring, desperate and scared",t3_a81txr,2.0,0.6,absolutely_MAD
0.0,1545181829.0,6.0,caltech,"Hey everyone! I'm an early admit to Caltech and I would like several questions answered before I finalize my decisions on May 1st.

1. Do you ever felt hampered by the small class size, or empowered by it? If possible, please enlighten me on the housing system and its intricacies not covered on the website.
2. How much free time, including the weekends, do you have in total?
3. How are the GPAs at Caltech?
4. How are the clubs and activities at Caltech? Do you have at least enough time outside of studying to participate in them?
5. Is core as bad as they make it out to be, or has it gotten better in recent years?
6. What kind of options do you have for breakfast, lunch, and dinner? By no means do I mean just inside the houses, I'm asking if there are local and chain restaurants worth going to. (even LA is fine)
7. About Pass/Fail. I read that the first two terms are P/F, so does that mean something like Fall and Winter term in Freshman year? What are your options for P/F after those two terms?
8. What are some relatively fun electives that you took?
9. What are your travel options if you don't have a car?

Thanks for taking the time to answer my questions!",Prospective Student Questions,t3_a7hgtr,6.0,1.0,Avarel_
0.0,1544518675.0,5.0,caltech,"I am an applicant from India and aspiring to get into Caltech for Electrical engineering but I need some sort of financial assistance to get my studies there. Do Caltech give Financial Aids to International student, if not then I will not apply to Caltech.",Do Caltech provides some kind of financial assistance to International students.,t3_a556ry,5.0,1.0,Ut-Mis_is_great
0.0,1544461941.0,2.0,caltech,"Hello,

I'm a high school senior, and two days ago I was deferred from Caltech EA fall 2019. Caltech is my first choice of schools, and my second is Harvey Mudd. I can either do ED 2 there or do RD. So here are my questions:

1. What are the odds that I'll get in to Caltech after being deferred? If it is very low, I will go ahead and apply to HMC ED2 (binding). If there is a chance, I'll RD to HMC. Does anyone have any statistics on this?

2. What material can I send Caltech now that will help my case? I sent recommendation letters from my Physics and Geography teachers, should I send one from my math teacher as well? Should I write a letter of continued interest or something like that? If so, what can I put on there? 


Thank you in advance.





","Need advice: deferred from Caltech, want to apply to Harvey Mudd",t3_a4xjjo,2.0,0.75,daksh510
0.0,1544392199.0,21.0,caltech,hello!! im a high school senior who was accepted  to caltech EA. im also a lesbian from a conservative backwater-swamp town and im wondering whether ill find people like me at caltech.,how gay is caltech (literally),t3_a4p5z1,21.0,0.97,[deleted]
0.0,1544304393.0,7.0,caltech,"Hi guys,

I just got deferred from Caltech. Could any current students that got accepted in the regular decision round after getting rejected let me know what they sent in their update to improve their application? I don't want to lose hope yet :)

&amp;#x200B;

Thanks!!!",Anyone get in after being deferred?,t3_a4ergj,7.0,0.89,[deleted]
0.0,1544277055.0,2.0,caltech,"So it's pretty much confirmed decisions are coming out today, but does anyone have a time? Historical basis would be awesome.",EA Decisions,t3_a4auip,2.0,1.0,christheyankee
0.0,1543073936.0,1.0,caltech,"Hey , I am an international student I was wondering if you would be able to answer a few of my questions about Caltech?

The best thing about your school? 

Worst thing about your school? 

What's the coolest course?

Is there a unique course, like other colleges don't have it ?

How open is your relationship with your professors? Can you go ask them questions after a lecture?

Are people more friendly or competitive? Like do people help each other with school work or it's like each with their own book

How is the social life, party scene? Like is there a lot or mostly study and Only get together once a week or so ?

Is anything cool that you go outside the college for ?

This might be kinda weird but if you could give me like a rating of how much you like it there in total it would be nice.

If it's too much feel free to not answer any question, and elaborate as much as you want.",Help an international applicant out?,t3_9zzdsu,1.0,0.67,tomorbotan
0.0,1543370368.0,0.0,caltech,,California Institute of Technology? More like,t3_a11lw4,0.0,0.5,[deleted]
0.0,1543071390.0,2.0,caltech,"I'm from a different country and I'm following Golwala's notes for Ph106ab ,bc and Ph125ab. Assignments of Classical Mechanics and Quantum mechanics courses are available online, but ph106bc Classical electrodynamics assignments can only be accessed from Caltech server. Could some gentle soul please share the assignments and question papers? Here is the link
http://www.astro.caltech.edu/~golwala/ph106bc/

May ~~god~~ universe bless you with good sleep and grades.
Thank you ",Phy106bc assignments request,t3_9zz269,2.0,0.66,RickRazor
0.0,1542591707.0,0.0,caltech,"Hi, I'm An Economics And Mathematics Major (Freshmen Year), and I'm planning to transfer to Caltech. The One thing I can't figure out is The Transfer Examination(Specifically the Physics Part). Can anyone suggest me some books and topics so that I could ace the exam?

The Last time I Studied Physics is in my 10th! Please Help Me!",Caltech Transfer Examination,t3_9yc3lf,0.0,0.4,malayilneil
0.0,1542457613.0,0.0,caltech,"Can I ever get into a top college with decent extracurricular activities ( probably 3 - 4) ,but exceptional SAT score and a hell lot of interest in subject?",College admission.,t3_9xw02k,0.0,0.27,Physics_lover123
0.0,1541636901.0,14.0,caltech,"Hi! You may know that two (!!) of this year’s MacArthur “genius grant” Award winners are Caltech alums. We're excited to share that they’ve made themselves available to answer selected questions from the Caltech community, which will be published in the next issue of Caltech Magazine.

[Doris Tsao (BS ’96)](https://youtu.be/0NNQv4vcpd8), Caltech professor of biology, won for her work on the neural mechanisms underlying primate vision. 

[Sarah Stewart (PhD ’02)](https://youtu.be/XJwswItoo-Q) was recognized for research exploring how celestial collisions give birth to planets.

We hope you'll post your questions for Doris and Sarah!","Do you have questions for Caltech's 2018 MacArthur ""Geniuses""?",t3_9v54cw,14.0,1.0,caltechedu
0.0,1541543126.0,5.0,caltech,"Hi, prospective student here.  

What is this major about?  Is it a general engineering degree?  What are the types of jobs/paths that grads with this major go into?

Thank you!",Engineering &amp; Applied Science?,t3_9ut53q,5.0,0.86,caltechquestions
0.0,1541050184.0,3.0,caltech,Hi ! Gonna be arriving to Pasadena in mid/third week of November. Looking for a potential roomie to split rent with.,"Looking for someone to split rent with, in Pasadena/Monrovia",t3_9t6rgg,3.0,0.8,RationalWank
